source,page,material,quantity,source_region,distance_km,artifact_type,site,raw_text
DirectionalExchangePatternsDurringPovertyPoint2.pdf,6,galena,1982,,,,,"by Frederick H. West and Robert W. Neuman, pp.7-18. Geoscience and Man VO~. 22. Louisiana State University, Baton Rouge. Walthall, John A., Clarence H. Webb, Stephan H. Stow, and Sharon I. Goad 1982 Galena analysis and Poverty Point trade, Midcontinental Journal of Archaeology 7(1): 133-148. Webb, Clarence H. 1982 The Poverty Point Culture. Geoscience and Man Vol. 17. 2nd edition, revised. Louisian"
Hays-2018-FeastingatPovertyPointwithPovertyPointObjects.pdf,3,copper,23,,,,,"nt to other major Late Archaic sites. Artifacts Poverty Point Indian Knoll Riverton culture sites Plummets 2,790 0 0 Projectile points 11,714 8,714 261 Stone beads 1,214 88 51 Microliths ca. 30,000 0 23 Copper objects 155 5 ca. 4 Stone gorgets 546 3 0 Pendants 296 3 6 Celts/adzes/axes 445 187 1 Hammerstones 348 665 10 Banner/boat stones 67 43 0 Galena objects 702 0 0 Clay ﬁgurines 133 0 0 Pipes 50+ 0 1 Ste"
Hays-2018-FeastingatPovertyPointwithPovertyPointObjects.pdf,3,steatite,1,,,,,"opper objects 155 5 ca. 4 Stone gorgets 546 3 0 Pendants 296 3 6 Celts/adzes/axes 445 187 1 Hammerstones 348 665 10 Banner/boat stones 67 43 0 Galena objects 702 0 0 Clay ﬁgurines 133 0 0 Pipes 50+ 0 1 Steatite objects 2,221 0 0 Note: Sources for information are Webb (1974, 1982) and Winters (1969). Figure 2. Example of a large concentration of PPOs at Poverty Point from N55 E15, Feature 6, Sharon I. Goad e"
Hays-2018-FeastingatPovertyPointwithPovertyPointObjects.pdf,3,galena,0,,,,,"14 261 Stone beads 1,214 88 51 Microliths ca. 30,000 0 23 Copper objects 155 5 ca. 4 Stone gorgets 546 3 0 Pendants 296 3 6 Celts/adzes/axes 445 187 1 Hammerstones 348 665 10 Banner/boat stones 67 43 0 Galena objects 702 0 0 Clay ﬁgurines 133 0 0 Pipes 50+ 0 1 Steatite objects 2,221 0 0 Note: Sources for information are Webb (1974, 1982) and Winters (1969). Figure 2. Example of a large concentration of PP"
Jackson-1981-PovertyPointSettlementSystems.pdf,15,galena,1982,,,,,"ological Papers 57. Thomas P.M. and L.J. Campbell i ! 1978 The peripheries of Poverty Point. New World Research Report of Investigations 12. I Walthall, J.A., C.H. Webb, S.H. Stow, and S. Goad 1982 Galena analysis and Poverty Point trade. Mid- 1 continental Journal of Archaeology 71 1) : 133-148. Webb, Clarence H. 1968 The extent and content of Poverty Point. American Antiquity 33 : 297-321. 197"
Webb-1956-Poverty Point a late archaic-… papers of the American Museum of Natural …-1.pdf,99,steatite,3,,,,,"36 176 Lengths, 3.2-12.7 cm.; shapes range from crudely finished oval forms to beautifully polished long teardrops, a few pear-shaped; 162 magnetite or hematite, 1 fluorite, 8 chert, 1 igneous rock, 3 steatite, 1 baked clay; in 16, holes drilled from one side only, remainder drilled from both sides; 5 of mag- netite or hematite and 1 of chert have uncompleted perforations (Fig. 33e) Grooved (Fig. 33m-n) 41"
Webb-1956-Poverty Point a late archaic-… papers of the American Museum of Natural …-1.pdf,108,galena,14,,,,,". A sharply pointed tool, possibly a piece of flint, was used to incise a groove on each face until the material was thin enough to fracture. FRAGMENTS OF GALENA Figure 34d, e The collections include 14 fragments of galena: 11 were collected on the surface, and one came from the fill of Mound B. Most of them are small and have the right-angled frac- ture planes that are normal for lead ore. How- ever, two from the surf"
Webb-1956-Poverty Point a late archaic-… papers of the American Museum of Natural …-1.pdf,110,steatite,3000,,,,,"robably made during the entire time ofoccupa- tion. However, the amount of pottery made was obviously very small. Our total collection of 32 fiber-tempered potsherds may be com- pared with the almost 3000 steatite vessel frag- ments recovered, or the thousands of fired-clay balls that were apparently used for cooking. This fiber-tempered pottery is very similar in appearance to that from the Tennessee River Va"
